{"fixture_id":"retry-reconciliation","family":"retry_reconciliation","input":{"core_contract":{"status":"compatible","core_revision":"core-rev-1"},"multica":{}},"expected_result":{"review":{"conclusion":"APPROVABLE"},"packet":{"ref":"ARCH-APPROVAL-PACKET","version":"v3","digest":"sha256:aaaaaaaaaaaaaaaaaaaaaaaaaaaaaaaaaaaaaaaaaaaaaaaaaaaaaaaaaaaaaaaa"},"delivery":{"state":"ready","issue_ref":"I-5","comment_ref":"C-5","delivery_evidence_ref":"multica://issues/I-5/comments/C-5#adapter-delivery-evidence-v1","attempt_id":"retry","fence_outcome":"current","reconciliation_outcome":"repaired_projection"},"readiness":{"state":"review_packet_ready","packet_digest":"sha256:aaaaaaaaaaaaaaaaaaaaaaaaaaaaaaaaaaaaaaaaaaaaaaaaaaaaaaaaaaaaaaaa","delivery_evidence_ref":"multica://issues/I-5/comments/C-5#adapter-delivery-evidence-v1","evidence_ref":"workspace://architecture-approvals/ARCH-APPROVAL-PACKET/v3/aaaaaaaaaaaaaaaaaaaaaaaaaaaaaaaaaaaaaaaaaaaaaaaaaaaaaaaaaaaaaaaa/readiness-retry.md","artifacts":[{"artifact_kind":"design","issue_ref":"I-5","comment_ref":"C-5","attachment_ref":"D-5","media_type":"text/markdown","availability_scope":"W-1/I-5","expected_digest":"sha256:aaaaaaaaaaaaaaaaaaaaaaaaaaaaaaaaaaaaaaaaaaaaaaaaaaaaaaaaaaaaaaaa","verified_digest":"sha256:aaaaaaaaaaaaaaaaaaaaaaaaaaaaaaaaaaaaaaaaaaaaaaaaaaaaaaaaaaaaaaaa","stable_access_ref":"D-5","verifier":"test","verified_at":"2026-08-30T12:00:00Z","target_human_mapping_evidence_ref":"workspace://architecture-approvals/ARCH-APPROVAL-PACKET/v3/aaaaaaaaaaaaaaaaaaaaaaaaaaaaaaaaaaaaaaaaaaaaaaaaaaaaaaaaaaaaaaaa/mapping-M-5.md"},{"artifact_kind":"review","issue_ref":"I-5","comment_ref":"C-5","attachment_ref":"R-5","media_type":"text/markdown","availability_scope":"W-1/I-5","expected_digest":"sha256:aaaaaaaaaaaaaaaaaaaaaaaaaaaaaaaaaaaaaaaaaaaaaaaaaaaaaaaaaaaaaaaa","verified_digest":"sha256:aaaaaaaaaaaaaaaaaaaaaaaaaaaaaaaaaaaaaaaaaaaaaaaaaaaaaaaaaaaaaaaa","stable_access_ref":"R-5","verifier":"test","verified_at":"2026-08-30T12:00:00Z","target_human_mapping_evidence_ref":"workspace://architecture-approvals/ARCH-APPROVAL-PACKET/v3/aaaaaaaaaaaaaaaaaaaaaaaaaaaaaaaaaaaaaaaaaaaaaaaaaaaaaaaaaaaaaaaa/mapping-M-5.md"},{"artifact_kind":"packet","issue_ref":"I-5","comment_ref":"C-5","attachment_ref":"P-5","media_type":"text/markdown","availability_scope":"W-1/I-5","expected_digest":"sha256:aaaaaaaaaaaaaaaaaaaaaaaaaaaaaaaaaaaaaaaaaaaaaaaaaaaaaaaaaaaaaaaa","verified_digest":"sha256:aaaaaaaaaaaaaaaaaaaaaaaaaaaaaaaaaaaaaaaaaaaaaaaaaaaaaaaaaaaaaaaa","stable_access_ref":"P-5","verifier":"test","verified_at":"2026-08-30T12:00:00Z","target_human_mapping_evidence_ref":"workspace://architecture-approvals/ARCH-APPROVAL-PACKET/v3/aaaaaaaaaaaaaaaaaaaaaaaaaaaaaaaaaaaaaaaaaaaaaaaaaaaaaaaaaaaaaaaa/mapping-M-5.md"}]},"target_human":{"mapping_status":"unique","actor_id":"member-1","mapping_evidence_ref":"workspace://architecture-approvals/ARCH-APPROVAL-PACKET/v3/aaaaaaaaaaaaaaaaaaaaaaaaaaaaaaaaaaaaaaaaaaaaaaaaaaaaaaaaaaaaaaaa/mapping-M-5.md","access_confirmation":"confirmed"},"recommendation":"recommend_approved_for_spec","decision":"none","workflow":{"stage":"waiting_human","wait_reason":"design_approval","blocker":"none"},"fake_cli":{"calls":["comment list"]},"limitations":[]}}
