{"fixture_id":"activation-boundary","family":"activation_boundary","input":{"core_contract":{"status":"compatible","core_revision":"core-rev-1"},"multica":{"activation_requested":false}},"expected_result":{"review":{"conclusion":"none"},"packet":{"ref":"ARCH-APPROVAL-PACKET","version":"none","digest":"none"},"delivery":{"state":"none","issue_ref":"none","comment_ref":"none","delivery_evidence_ref":"none","attempt_id":"attempt-activation","fence_outcome":"none","reconciliation_outcome":"none"},"readiness":{"state":"none","packet_digest":"none","delivery_evidence_ref":"none","evidence_ref":"none","artifacts":[]},"target_human":{"mapping_status":"none","actor_id":"none","mapping_evidence_ref":"none","access_confirmation":"none"},"recommendation":"none","decision":"none","availability":{"core_packet":"available","activation":"not_activated"},"workflow":{"stage":"intake","wait_reason":"none","blocker":"none"},"fake_cli":{"calls":[]},"limitations":["no import, binding, or real workspace mutation without explicit authorization"]}}
