{"fixture_id":"superseded-decision","family":"superseded_decision","input":{"core_contract":{"status":"compatible","core_revision":"core-rev-1"},"multica":{}},"expected_result":{"review":{"conclusion":"APPROVABLE"},"packet":{"ref":"ARCH-APPROVAL-PACKET","version":"v3","digest":"sha256:aaaaaaaaaaaaaaaaaaaaaaaaaaaaaaaaaaaaaaaaaaaaaaaaaaaaaaaaaaaaaaaa"},"delivery":{"state":"ready","issue_ref":"I-8","comment_ref":"C-8","delivery_evidence_ref":"multica://issues/I-8/comments/C-8#adapter-delivery-evidence-v1","attempt_id":"superseded","fence_outcome":"current","reconciliation_outcome":"reused_exact"},"readiness":{"state":"review_packet_ready","packet_digest":"sha256:aaaaaaaaaaaaaaaaaaaaaaaaaaaaaaaaaaaaaaaaaaaaaaaaaaaaaaaaaaaaaaaa","delivery_evidence_ref":"multica://issues/I-8/comments/C-8#adapter-delivery-evidence-v1","evidence_ref":"workspace://architecture-approvals/ARCH-APPROVAL-PACKET/v3/aaaaaaaaaaaaaaaaaaaaaaaaaaaaaaaaaaaaaaaaaaaaaaaaaaaaaaaaaaaaaaaa/readiness-superseded.md","artifacts":[{"artifact_kind":"design","issue_ref":"I-8","comment_ref":"C-8","attachment_ref":"D-8","media_type":"text/markdown","availability_scope":"W-1/I-8","expected_digest":"sha256:aaaaaaaaaaaaaaaaaaaaaaaaaaaaaaaaaaaaaaaaaaaaaaaaaaaaaaaaaaaaaaaa","verified_digest":"sha256:aaaaaaaaaaaaaaaaaaaaaaaaaaaaaaaaaaaaaaaaaaaaaaaaaaaaaaaaaaaaaaaa","stable_access_ref":"D-8","verifier":"test","verified_at":"2026-08-30T12:00:00Z","target_human_mapping_evidence_ref":"workspace://architecture-approvals/ARCH-APPROVAL-PACKET/v3/aaaaaaaaaaaaaaaaaaaaaaaaaaaaaaaaaaaaaaaaaaaaaaaaaaaaaaaaaaaaaaaa/mapping-M-8.md"},{"artifact_kind":"review","issue_ref":"I-8","comment_ref":"C-8","attachment_ref":"R-8","media_type":"text/markdown","availability_scope":"W-1/I-8","expected_digest":"sha256:aaaaaaaaaaaaaaaaaaaaaaaaaaaaaaaaaaaaaaaaaaaaaaaaaaaaaaaaaaaaaaaa","verified_digest":"sha256:aaaaaaaaaaaaaaaaaaaaaaaaaaaaaaaaaaaaaaaaaaaaaaaaaaaaaaaaaaaaaaaa","stable_access_ref":"R-8","verifier":"test","verified_at":"2026-08-30T12:00:00Z","target_human_mapping_evidence_ref":"workspace://architecture-approvals/ARCH-APPROVAL-PACKET/v3/aaaaaaaaaaaaaaaaaaaaaaaaaaaaaaaaaaaaaaaaaaaaaaaaaaaaaaaaaaaaaaaa/mapping-M-8.md"},{"artifact_kind":"packet","issue_ref":"I-8","comment_ref":"C-8","attachment_ref":"P-8","media_type":"text/markdown","availability_scope":"W-1/I-8","expected_digest":"sha256:aaaaaaaaaaaaaaaaaaaaaaaaaaaaaaaaaaaaaaaaaaaaaaaaaaaaaaaaaaaaaaaa","verified_digest":"sha256:aaaaaaaaaaaaaaaaaaaaaaaaaaaaaaaaaaaaaaaaaaaaaaaaaaaaaaaaaaaaaaaa","stable_access_ref":"P-8","verifier":"test","verified_at":"2026-08-30T12:00:00Z","target_human_mapping_evidence_ref":"workspace://architecture-approvals/ARCH-APPROVAL-PACKET/v3/aaaaaaaaaaaaaaaaaaaaaaaaaaaaaaaaaaaaaaaaaaaaaaaaaaaaaaaaaaaaaaaa/mapping-M-8.md"}]},"target_human":{"mapping_status":"unique","actor_id":"member-1","mapping_evidence_ref":"workspace://architecture-approvals/ARCH-APPROVAL-PACKET/v3/aaaaaaaaaaaaaaaaaaaaaaaaaaaaaaaaaaaaaaaaaaaaaaaaaaaaaaaaaaaaaaaa/mapping-M-8.md","access_confirmation":"confirmed"},"recommendation":"recommend_approved_for_spec","decision":{"token":"approved_for_spec","evidence_status":"noop","binding_profile":"multica_packet_comment_reply_v1","evidence_ref":"E-8","author_id":"member-1","author_type":"member","issue_ref":"I-8","comment_ref":"E-8","parent_chain":["E-8","C-v2"],"explicit_packet_identity":{"ref":"none","version":"none","digest":"none"},"comment_revision":"r1","content_digest":"sha256:cccccccccccccccccccccccccccccccccccccccccccccccccccccccccccccccc","created_at":"2026-08-30T12:01:00Z","updated_at":"2026-08-30T12:01:00Z","recorded_at":"2026-08-30T12:02:00Z","target_human_mapping_evidence_ref":"workspace://architecture-approvals/ARCH-APPROVAL-PACKET/v3/aaaaaaaaaaaaaaaaaaaaaaaaaaaaaaaaaaaaaaaaaaaaaaaaaaaaaaaaaaaaaaaa/mapping-M-8.md","packet_ref":"ARCH-APPROVAL-PACKET","packet_version":"v2","packet_digest":"sha256:bbbbbbbbbbbbbbbbbbbbbbbbbbbbbbbbbbbbbbbbbbbbbbbbbbbbbbbbbbbbbbbb","reread_status":"verified"},"workflow":{"stage":"waiting_human","wait_reason":"design_approval","blocker":"none"},"fake_cli":{"calls":["comment list"]},"limitations":[]}}
