{"fixture_id":"capability-missing","family":"capability_missing","input":{"core_contract":{"status":"compatible","core_revision":"core-rev-1"},"multica":{"missing_capability":"attachment-redownload"}},"expected_result":{"review":{"conclusion":"APPROVABLE_WITH_WARNINGS"},"packet":{"ref":"ARCH-APPROVAL-PACKET","version":"v3","digest":"sha256:aaaaaaaaaaaaaaaaaaaaaaaaaaaaaaaaaaaaaaaaaaaaaaaaaaaaaaaaaaaaaaaa"},"delivery":{"state":"unavailable","issue_ref":"multica://issues/I-2","comment_ref":"none","delivery_evidence_ref":"none","attempt_id":"attempt-capability","fence_outcome":"none","reconciliation_outcome":"none"},"readiness":{"state":"review_packet_unavailable","packet_digest":"sha256:aaaaaaaaaaaaaaaaaaaaaaaaaaaaaaaaaaaaaaaaaaaaaaaaaaaaaaaaaaaaaaaa","delivery_evidence_ref":"none","evidence_ref":"none","artifacts":[]},"target_human":{"mapping_status":"unique","actor_id":"member-1","mapping_evidence_ref":"mapping-1","access_confirmation":"unconfirmed"},"recommendation":"recommend_approved_for_spec","decision":"none","workflow":{"stage":"reviewing","wait_reason":"none","blocker":"review_packet_unavailable"},"fake_cli":{"calls":["issue get I-2","attachment get --help"]},"limitations":["attachment-redownload unavailable"]}}
