{"fixture_id":"core-incompatible","family":"core_incompatible","input":{"core_contract":{"status":"incompatible","core_revision":"core-rev-unknown"},"multica":{}},"expected_result":{"review":{"conclusion":"APPROVABLE"},"packet":{"ref":"ARCH-APPROVAL-PACKET","version":"v3","digest":"sha256:aaaaaaaaaaaaaaaaaaaaaaaaaaaaaaaaaaaaaaaaaaaaaaaaaaaaaaaaaaaaaaaa"},"delivery":{"state":"unavailable","issue_ref":"multica://issues/I-1","comment_ref":"none","delivery_evidence_ref":"none","attempt_id":"attempt-core-incompatible","fence_outcome":"none","reconciliation_outcome":"none"},"readiness":{"state":"review_packet_unavailable","packet_digest":"sha256:aaaaaaaaaaaaaaaaaaaaaaaaaaaaaaaaaaaaaaaaaaaaaaaaaaaaaaaaaaaaaaaa","delivery_evidence_ref":"none","evidence_ref":"none","artifacts":[]},"target_human":{"mapping_status":"none","actor_id":"none","mapping_evidence_ref":"none","access_confirmation":"none"},"recommendation":"recommend_approved_for_spec","decision":"none","workflow":{"stage":"reviewing","wait_reason":"none","blocker":"none"},"fake_cli":{"calls":[]},"limitations":["core revision is incompatible"]}}
