{"fixture_id":"digest-mismatch","family":"digest_mismatch","input":{"core_contract":{"status":"compatible","core_revision":"core-rev-1"},"multica":{"downloaded_digest":"sha256:bbbbbbbbbbbbbbbbbbbbbbbbbbbbbbbbbbbbbbbbbbbbbbbbbbbbbbbbbbbbbbbb"}},"expected_result":{"review":{"conclusion":"APPROVABLE"},"packet":{"ref":"ARCH-APPROVAL-PACKET","version":"v3","digest":"sha256:aaaaaaaaaaaaaaaaaaaaaaaaaaaaaaaaaaaaaaaaaaaaaaaaaaaaaaaaaaaaaaaa"},"delivery":{"state":"delivered_unverified","issue_ref":"multica://issues/I-4","comment_ref":"multica://issues/I-4/comments/C-4","delivery_evidence_ref":"multica://issues/I-4/comments/C-4#adapter-delivery-evidence-v1","attempt_id":"attempt-digest","fence_outcome":"current","reconciliation_outcome":"new_delivery"},"readiness":{"state":"review_packet_unavailable","packet_digest":"sha256:aaaaaaaaaaaaaaaaaaaaaaaaaaaaaaaaaaaaaaaaaaaaaaaaaaaaaaaaaaaaaaaa","delivery_evidence_ref":"multica://issues/I-4/comments/C-4#adapter-delivery-evidence-v1","evidence_ref":"none","artifacts":[{"artifact_kind":"packet","issue_ref":"multica://issues/I-4","comment_ref":"multica://issues/I-4/comments/C-4","attachment_id":"A-4","attachment_ref":"multica://issues/I-4/comments/C-4/attachments/A-4","expected_digest":"sha256:aaaaaaaaaaaaaaaaaaaaaaaaaaaaaaaaaaaaaaaaaaaaaaaaaaaaaaaaaaaaaaaa","observed_digest":"sha256:bbbbbbbbbbbbbbbbbbbbbbbbbbbbbbbbbbbbbbbbbbbbbbbbbbbbbbbbbbbbbbbb","binding_status":"bound","reread_status":"digest_mismatch","stable_access_ref":"multica://issues/I-4/comments/C-4/attachments/A-4"}]},"target_human":{"mapping_status":"unique","actor_id":"member-1","mapping_evidence_ref":"mapping-4","access_confirmation":"confirmed"},"recommendation":"recommend_approved_for_spec","decision":"none","workflow":{"stage":"reviewing","wait_reason":"none","blocker":"review_packet_unavailable"},"fake_cli":{"calls":["comment list I-4 --thread","attachment download A-4"]},"limitations":["downloaded bytes differ from frozen digest"]}}
