{"fixture_id":"successful-delivery","family":"successful_delivery","input":{"core_contract":{"status":"compatible","core_revision":"core-rev-1"},"multica":{"target_member":"member-1"}},"expected_result":{"review":{"conclusion":"APPROVABLE"},"packet":{"ref":"ARCH-APPROVAL-PACKET","version":"v3","digest":"sha256:aaaaaaaaaaaaaaaaaaaaaaaaaaaaaaaaaaaaaaaaaaaaaaaaaaaaaaaaaaaaaaaa"},"delivery":{"state":"ready","issue_ref":"multica://issues/I-3","comment_ref":"multica://issues/I-3/comments/C-3","delivery_evidence_ref":"multica://issues/I-3/comments/C-3#adapter-delivery-evidence-v1","attempt_id":"attempt-delivery","fence_outcome":"current","reconciliation_outcome":"new_delivery"},"readiness":{"state":"review_packet_ready","packet_digest":"sha256:aaaaaaaaaaaaaaaaaaaaaaaaaaaaaaaaaaaaaaaaaaaaaaaaaaaaaaaaaaaaaaaa","delivery_evidence_ref":"multica://issues/I-3/comments/C-3#adapter-delivery-evidence-v1","evidence_ref":"workspace://architecture-approvals/ARCH-APPROVAL-PACKET/v3/aaaaaaaaaaaaaaaaaaaaaaaaaaaaaaaaaaaaaaaaaaaaaaaaaaaaaaaaaaaaaaaa/readiness-attempt-delivery.md","artifacts":[{"artifact_kind":"design","issue_ref":"multica://issues/I-3","comment_ref":"multica://issues/I-3/comments/C-3","attachment_ref":"multica://issues/I-3/comments/C-3/attachments/A-design","media_type":"text/markdown","availability_scope":"multica_workspace:W-1/issue:I-3","expected_digest":"sha256:aaaaaaaaaaaaaaaaaaaaaaaaaaaaaaaaaaaaaaaaaaaaaaaaaaaaaaaaaaaaaaaa","verified_digest":"sha256:aaaaaaaaaaaaaaaaaaaaaaaaaaaaaaaaaaaaaaaaaaaaaaaaaaaaaaaaaaaaaaaa","stable_access_ref":"multica://issues/I-3/comments/C-3/attachments/A-design","verifier":"adapter-test","verified_at":"2026-08-30T12:00:00Z","target_human_mapping_evidence_ref":"workspace://architecture-approvals/ARCH-APPROVAL-PACKET/v3/aaaaaaaaaaaaaaaaaaaaaaaaaaaaaaaaaaaaaaaaaaaaaaaaaaaaaaaaaaaaaaaa/mapping-mapping-3.md"},{"artifact_kind":"review","issue_ref":"multica://issues/I-3","comment_ref":"multica://issues/I-3/comments/C-3","attachment_ref":"multica://issues/I-3/comments/C-3/attachments/A-review","media_type":"text/markdown","availability_scope":"multica_workspace:W-1/issue:I-3","expected_digest":"sha256:aaaaaaaaaaaaaaaaaaaaaaaaaaaaaaaaaaaaaaaaaaaaaaaaaaaaaaaaaaaaaaaa","verified_digest":"sha256:aaaaaaaaaaaaaaaaaaaaaaaaaaaaaaaaaaaaaaaaaaaaaaaaaaaaaaaaaaaaaaaa","stable_access_ref":"multica://issues/I-3/comments/C-3/attachments/A-review","verifier":"adapter-test","verified_at":"2026-08-30T12:00:00Z","target_human_mapping_evidence_ref":"workspace://architecture-approvals/ARCH-APPROVAL-PACKET/v3/aaaaaaaaaaaaaaaaaaaaaaaaaaaaaaaaaaaaaaaaaaaaaaaaaaaaaaaaaaaaaaaa/mapping-mapping-3.md"},{"artifact_kind":"packet","issue_ref":"multica://issues/I-3","comment_ref":"multica://issues/I-3/comments/C-3","attachment_ref":"multica://issues/I-3/comments/C-3/attachments/A-packet","media_type":"text/markdown","availability_scope":"multica_workspace:W-1/issue:I-3","expected_digest":"sha256:aaaaaaaaaaaaaaaaaaaaaaaaaaaaaaaaaaaaaaaaaaaaaaaaaaaaaaaaaaaaaaaa","verified_digest":"sha256:aaaaaaaaaaaaaaaaaaaaaaaaaaaaaaaaaaaaaaaaaaaaaaaaaaaaaaaaaaaaaaaa","stable_access_ref":"multica://issues/I-3/comments/C-3/attachments/A-packet","verifier":"adapter-test","verified_at":"2026-08-30T12:00:00Z","target_human_mapping_evidence_ref":"workspace://architecture-approvals/ARCH-APPROVAL-PACKET/v3/aaaaaaaaaaaaaaaaaaaaaaaaaaaaaaaaaaaaaaaaaaaaaaaaaaaaaaaaaaaaaaaa/mapping-mapping-3.md"}]},"target_human":{"mapping_status":"unique","actor_id":"member-1","mapping_evidence_ref":"workspace://architecture-approvals/ARCH-APPROVAL-PACKET/v3/aaaaaaaaaaaaaaaaaaaaaaaaaaaaaaaaaaaaaaaaaaaaaaaaaaaaaaaaaaaaaaaa/mapping-mapping-3.md","access_confirmation":"confirmed"},"recommendation":"recommend_approved_for_spec","decision":"none","workflow":{"stage":"waiting_human","wait_reason":"design_approval","blocker":"none"},"fake_cli":{"calls":["comment add I-3 --attachment design.md --attachment review.md --attachment packet.md","comment list I-3 --thread","attachment get A-design","attachment get A-review","attachment get A-packet","metadata set arch.packet.current"]},"limitations":[]}}
