{"fixture_id":"core-absent","family":"core_absent","input":{"core_contract":{"status":"absent","core_revision":"none"},"multica":{}},"expected_result":{"review":{"conclusion":"none"},"packet":{"ref":"ARCH-APPROVAL-PACKET","version":"none","digest":"none"},"delivery":{"state":"unavailable","issue_ref":"multica://issues/I-1","comment_ref":"none","delivery_evidence_ref":"none","attempt_id":"attempt-core-absent","fence_outcome":"none","reconciliation_outcome":"none"},"readiness":{"state":"review_packet_unavailable","packet_digest":"none","delivery_evidence_ref":"none","evidence_ref":"none","artifacts":[]},"target_human":{"mapping_status":"none","actor_id":"none","mapping_evidence_ref":"none","access_confirmation":"none"},"recommendation":"none","decision":"none","availability":{"core_packet":"unavailable","activation":"not_applicable"},"workflow":{"stage":"intake","wait_reason":"none","blocker":"none"},"fake_cli":{"calls":[]},"limitations":["core packet is absent"]}}
